{
  "$schema": "https://json-schema.org/draft/2020-12/schema",
  "title": "ProductionRun",
  "type": "object",
  "required": ["run_id", "request_id", "status", "objective", "artifacts", "context_state", "qa"],
  "properties": {
    "run_id": { "type": "string" },
    "request_id": { "type": "string" },
    "project_id": { "type": "string" },
    "project_slug": { "type": "string" },
    "project_path": { "type": "string" },
    "objective": { "type": "string" },
    "status": {
      "type": "string",
      "enum": ["planned", "running", "needs_approval", "blocked", "complete", "revising", "failed"]
    },
    "current_phase": { "type": "string" },
    "artifact_root": { "type": "string" },
    "channel_profile_id": { "type": "string" },
    "channel_slug": { "type": "string" },
    "channel_profile_path": { "type": "string" },
    "channel_format_id": { "type": "string" },
    "channel_format_path": { "type": "string" },
    "producer_criteria_path": { "type": "string" },
    "media_asset_manifest_path": { "type": "string" },
    "scene_artifact_sync_report_path": { "type": "string" },
    "remotion_project_contract_path": { "type": "string" },
    "remotion_app_root_path": { "type": "string" },
    "context_state": {
      "type": "object",
      "required": ["status", "working_set_summary", "current_phase_summary", "last_resume_summary", "important_open_decisions", "active_blockers", "stale_or_invalidated_artifacts", "artifacts_to_reload_next", "next_actions", "context_budget_policy", "last_compacted_at"],
      "properties": {
        "status": {
          "type": "string",
          "enum": ["fresh", "compacted", "needs_compaction", "stale", "resume_required"]
        },
        "working_set_summary": { "type": "string" },
        "current_phase_summary": { "type": "string" },
        "last_resume_summary": { "type": "string" },
        "context_snapshot_path": { "type": "string" },
        "important_open_decisions": { "type": "array", "items": { "type": "string" } },
        "active_blockers": { "type": "array", "items": { "type": "string" } },
        "recent_user_requests": { "type": "array", "items": { "type": "string" } },
        "recent_changes": { "type": "array", "items": { "type": "string" } },
        "stale_or_invalidated_artifacts": { "type": "array", "items": { "type": "string" } },
        "artifacts_to_reload_next": {
          "type": "array",
          "items": {
            "type": "object",
            "required": ["kind", "path", "reason"],
            "properties": {
              "kind": { "type": "string" },
              "path": { "type": "string" },
              "reason": { "type": "string" }
            }
          }
        },
        "next_actions": { "type": "array", "items": { "type": "string" } },
        "context_budget_policy": { "type": "string" },
        "compaction_reason": { "type": "string" },
        "last_compacted_at": { "type": "string" }
      }
    },
    "context_snapshots": {
      "type": "array",
      "items": {
        "type": "object",
        "required": ["snapshot_id", "path", "phase", "reason", "summary", "created_at"],
        "properties": {
          "snapshot_id": { "type": "string" },
          "path": { "type": "string" },
          "phase": { "type": "string" },
          "reason": {
            "type": "string",
            "enum": ["phase_boundary", "review_loop", "user_change", "context_pressure", "resume", "manual"]
          },
          "summary": { "type": "string" },
          "created_at": { "type": "string" }
        }
      }
    },
    "artifacts": {
      "type": "array",
      "items": {
        "type": "object",
        "required": ["kind", "path", "status"],
        "properties": {
          "kind": { "type": "string" },
          "path": { "type": "string" },
          "owner_agent": { "type": "string" },
          "contract": { "type": "string" },
          "status": {
            "type": "string",
            "enum": ["planned", "in_progress", "complete", "needs_approval", "blocked", "stale", "superseded"]
          },
          "version": { "type": "string" },
          "notes": { "type": "string" }
        }
      }
    },
    "handoffs": {
      "type": "array",
      "items": {
        "type": "object",
        "required": ["handoff_id", "to_agent", "status"],
        "properties": {
          "handoff_id": { "type": "string" },
          "to_agent": { "type": "string" },
          "phase": { "type": "string" },
          "output_contract": { "type": "string" },
          "artifact_paths": { "type": "array", "items": { "type": "string" } },
          "status": {
            "type": "string",
            "enum": ["planned", "in_progress", "complete", "needs_approval", "blocked", "revising"]
          },
          "summary": { "type": "string" }
        }
      }
    },
    "approvals": {
      "type": "array",
      "items": {
        "type": "object",
        "required": ["approval_id", "status", "reason"],
        "properties": {
          "approval_id": { "type": "string" },
          "status": { "type": "string", "enum": ["pending", "approved", "rejected", "not_required"] },
          "reason": { "type": "string" },
          "cost_or_credit_estimate": { "type": "string" },
          "related_artifact": { "type": "string" },
          "notes": { "type": "string" }
        }
      }
    },
    "change_requests": {
      "type": "array",
      "items": {
        "type": "object",
        "required": ["change_id", "request", "status", "impact"],
        "properties": {
          "change_id": { "type": "string" },
          "request": { "type": "string" },
          "status": { "type": "string", "enum": ["planned", "in_progress", "complete", "blocked", "rejected"] },
          "impact": {
            "type": "string",
            "enum": ["channel_profile", "channel_format", "channel", "source_media", "scenario", "scene_artifact_sync", "voiceover", "visual", "ai_generation", "remotion_template", "remotion_clip", "remotion_setup", "timeline", "timeline_sync", "critique", "delivery_metadata", "unknown"]
          },
          "affected_artifacts": { "type": "array", "items": { "type": "string" } },
          "actions": { "type": "array", "items": { "type": "string" } },
          "notes": { "type": "string" }
        }
      }
    },
    "review_loops": {
      "type": "array",
      "items": {
        "type": "object",
        "required": ["loop_id", "status", "iteration", "producer_criteria_path"],
        "properties": {
          "loop_id": { "type": "string" },
          "status": {
            "type": "string",
            "enum": ["planned", "running", "pass", "fail", "needs_approval", "blocked", "stopped"]
          },
          "iteration": { "type": "integer" },
          "max_iterations": { "type": "integer" },
          "render_package_path": { "type": "string" },
          "critique_report_path": { "type": "string" },
          "producer_criteria_path": { "type": "string" },
          "failed_gates": { "type": "array", "items": { "type": "string" } },
          "invalidated_artifacts": { "type": "array", "items": { "type": "string" } },
          "preserved_artifacts": { "type": "array", "items": { "type": "string" } },
          "rerun_scope": {
            "type": "array",
            "items": {
              "type": "string",
              "enum": ["channel_profile", "channel_format", "channel", "source_media", "scenario", "scene_artifact_sync", "voiceover", "visual", "ai_generation", "remotion_template", "remotion_clip", "remotion_setup", "timeline", "timeline_sync", "render", "critique", "delivery_metadata"]
            }
          },
          "routed_actions": {
            "type": "array",
            "items": {
              "type": "object",
              "required": ["owner_agent", "action"],
              "properties": {
                "owner_agent": { "type": "string" },
                "action": { "type": "string" },
                "related_finding": { "type": "string" },
                "status": {
                  "type": "string",
                  "enum": ["planned", "in_progress", "complete", "needs_approval", "blocked"]
                }
              }
            }
          },
          "next_action": {
            "type": "string",
            "enum": ["run_critic", "dispatch_revisions", "rerender", "approve_rc", "ask_user", "stop_blocked"]
          },
          "stop_reason": { "type": "string" }
        }
      }
    },
    "invalidation_graph": {
      "type": "object",
      "properties": {
        "status": {
          "type": "string",
          "enum": ["not_required", "active", "stale", "needs_review"]
        },
        "last_updated_at": { "type": "string" },
        "nodes": {
          "type": "array",
          "items": {
            "type": "object",
            "required": ["artifact_id", "artifact_path", "kind", "status"],
            "properties": {
              "artifact_id": { "type": "string" },
              "artifact_path": { "type": "string" },
              "kind": {
                "type": "string",
                "enum": [
                  "channel_profile",
                  "channel_format",
                  "source_media",
                  "reference_analysis",
                  "producer_criteria",
                  "scenario",
                  "scene_artifact_sync",
                  "voiceover_package",
                  "scene_visual_pack",
                  "clip_candidate",
                  "ai_video_generation_package",
                  "remotion_template",
                  "remotion_clip_package",
                  "timeline_sync_plan",
                  "render_package",
                  "critique_report",
                  "delivery_metadata",
                  "other"
                ]
              },
              "owner_agent": { "type": "string" },
              "version": { "type": "string" },
              "status": {
                "type": "string",
                "enum": ["current", "stale", "invalidated", "superseded", "blocked", "unknown"]
              },
              "reason": { "type": "string" }
            }
          }
        },
        "edges": {
          "type": "array",
          "items": {
            "type": "object",
            "required": ["from_artifact_id", "to_artifact_id", "dependency_type"],
            "properties": {
              "from_artifact_id": { "type": "string" },
              "to_artifact_id": { "type": "string" },
              "dependency_type": {
                "type": "string",
                "enum": ["depends_on", "derived_from", "consumes", "validates", "renders", "reviews", "supersedes"]
              },
              "invalidates_when_changed": { "type": "boolean" },
              "notes": { "type": "string" }
            }
          }
        },
        "events": {
          "type": "array",
          "items": {
            "type": "object",
            "required": ["event_id", "trigger", "affected_artifacts", "rerun_scope", "created_at"],
            "properties": {
              "event_id": { "type": "string" },
              "trigger": { "type": "string" },
              "source_finding_id": { "type": "string" },
              "source_change_id": { "type": "string" },
              "affected_artifacts": { "type": "array", "items": { "type": "string" } },
              "preserved_artifacts": { "type": "array", "items": { "type": "string" } },
              "rerun_scope": { "type": "array", "items": { "type": "string" } },
              "owner_agents": { "type": "array", "items": { "type": "string" } },
              "created_at": { "type": "string" },
              "notes": { "type": "string" }
            }
          }
        }
      }
    },
    "blockers": {
      "type": "array",
      "items": {
        "type": "object",
        "required": ["severity", "description"],
        "properties": {
          "severity": { "type": "string", "enum": ["blocker", "major", "minor", "note"] },
          "description": { "type": "string" },
          "owner_agent": { "type": "string" },
          "related_artifact": { "type": "string" },
          "resolution": { "type": "string" }
        }
      }
    },
    "qa": {
      "type": "object",
      "required": ["status", "summary"],
      "properties": {
        "status": { "type": "string", "enum": ["pass", "fail", "partial", "not_run"] },
        "summary": { "type": "string" },
        "residual_risks": { "type": "array", "items": { "type": "string" } }
      }
    }
  }
}
